[{"bt_run_id":"nfl_games_v1:7244a0bc8ac6","candidate":"C1","game_id":"2024_01_ARI_BUF","side":"home","clv_bps":283.909299439703,"units":0.363636363636364},{"bt_run_id":"nfl_games_v1:7244a0bc8ac6","candidate":"C1","game_id":"2024_01_BAL_KC","side":"away","clv_bps":177.881371526711,"units":-1},{"bt_run_id":"nfl_games_v1:7244a0bc8ac6","candidate":"C1","game_id":"2024_01_CAR_NO","side":"home","clv_bps":-273.147308030541,"units":0.476190476190476},{"bt_run_id":"nfl_games_v1:7244a0bc8ac6","candidate":"C1","game_id":"2024_01_DAL_CLE","side":"away","clv_bps":0,"units":1.1},{"bt_run_id":"nfl_games_v1:7244a0bc8ac6","candidate":"C1","game_id":"2024_01_DEN_SEA","side":"away","clv_bps":-437.884089887122,"units":-1},{"bt_run_id":"nfl_games_v1:7244a0bc8ac6","candidate":"C1","game_id":"2024_01_GB_PHI","side":"away","clv_bps":210.044083326131,"units":-1},{"bt_run_id":"nfl_games_v1:7244a0bc8ac6","candidate":"C1","game_id":"2024_01_LV_LAC","side":"away","clv_bps":108.807381922766,"units":-1},{"bt_run_id":"nfl_games_v1:7244a0bc8ac6","candidate":"C1","game_id":"2024_01_NE_CIN","side":"away","clv_bps":368.574517576908,"units":3.6},{"bt_run_id":"nfl_games_v1:7244a0bc8ac6","candidate":"C1","game_id":"2024_01_NYJ_SF","side":"home","clv_bps":-491.432422025413,"units":0.416666666666667},{"bt_run_id":"nfl_games_v1:7244a0bc8ac6","candidate":"C1","game_id":"2024_01_PIT_ATL","side":"away","clv_bps":-902.631400013599,"units":1.15},{"bt_run_id":"nfl_games_v1:7244a0bc8ac6","candidate":"C1","game_id":"2024_01_TEN_CHI","side":"away","clv_bps":57.843242662079,"units":-1},{"bt_run_id":"nfl_games_v1:7244a0bc8ac6","candidate":"C1","game_id":"2024_01_WAS_TB","side":"home","clv_bps":127.551020408163,"units":0.526315789473684},{"bt_run_id":"nfl_games_v1:7244a0bc8ac6","candidate":"C1","game_id":"2024_02_ATL_PHI","side":"home","clv_bps":748.538011695906,"units":-1},{"bt_run_id":"nfl_games_v1:7244a0bc8ac6","candidate":"C1","game_id":"2024_02_BUF_MIA","side":"away","clv_bps":-711.159737417943,"units":0.909090909090909},{"bt_run_id":"nfl_games_v1:7244a0bc8ac6","candidate":"C1","game_id":"2024_02_CHI_HOU","side":"away","clv_bps":-810.440029878873,"units":-1},{"bt_run_id":"nfl_games_v1:7244a0bc8ac6","candidate":"C1","game_id":"2024_02_CIN_KC","side":"home","clv_bps":945.538693359164,"units":0.571428571428571},{"bt_run_id":"nfl_games_v1:7244a0bc8ac6","candidate":"C1","game_id":"2024_02_CLE_JAX","side":"home","clv_bps":1140.35087719298,"units":-1},{"bt_run_id":"nfl_games_v1:7244a0bc8ac6","candidate":"C1","game_id":"2024_02_IND_GB","side":"home","clv_bps":279.763106757548,"units":1.4},{"bt_run_id":"nfl_games_v1:7244a0bc8ac6","candidate":"C1","game_id":"2024_02_LA_ARI","side":"away","clv_bps":-324.675324675325,"units":-1},{"bt_run_id":"nfl_games_v1:7244a0bc8ac6","candidate":"C1","game_id":"2024_02_LV_BAL","side":"away","clv_bps":-106.422018348622,"units":3},{"bt_run_id":"nfl_games_v1:7244a0bc8ac6","candidate":"C1","game_id":"2024_02_NO_DAL","side":"away","clv_bps":0,"units":2.4},{"bt_run_id":"nfl_games_v1:7244a0bc8ac6","candidate":"C1","game_id":"2024_02_NYG_WAS","side":"away","clv_bps":212.523935686549,"units":-1},{"bt_run_id":"nfl_games_v1:7244a0bc8ac6","candidate":"C1","game_id":"2024_02_NYJ_TEN","side":"home","clv_bps":273.147308030542,"units":-1},{"bt_run_id":"nfl_games_v1:7244a0bc8ac6","candidate":"C1","game_id":"2024_02_SEA_NE","side":"home","clv_bps":-108.807381922766,"units":-1},{"bt_run_id":"nfl_games_v1:7244a0bc8ac6","candidate":"C1","game_id":"2024_02_SF_MIN","side":"home","clv_bps":479.449479186251,"units":2.25},{"bt_run_id":"nfl_games_v1:7244a0bc8ac6","candidate":"C1","game_id":"2024_02_TB_DET","side":"away","clv_bps":-470.289366816601,"units":2.2},{"bt_run_id":"nfl_games_v1:7244a0bc8ac6","candidate":"C1","game_id":"2024_03_DEN_TB","side":"away","clv_bps":439.355385920273,"units":2.6},{"bt_run_id":"nfl_games_v1:7244a0bc8ac6","candidate":"C1","game_id":"2024_03_GB_TEN","side":"away","clv_bps":-473.644003055766,"units":1.05},{"bt_run_id":"nfl_games_v1:7244a0bc8ac6","candidate":"C1","game_id":"2024_03_HOU_MIN","side":"home","clv_bps":403.046651856553,"units":1.2},{"bt_run_id":"nfl_games_v1:7244a0bc8ac6","candidate":"C1","game_id":"2024_03_JAX_BUF","side":"home","clv_bps":-324.003392705683,"units":0.4},{"bt_run_id":"nfl_games_v1:7244a0bc8ac6","candidate":"C1","game_id":"2024_03_KC_ATL","side":"away","clv_bps":-497.878941194131,"units":0.465116279069767},{"bt_run_id":"nfl_games_v1:7244a0bc8ac6","candidate":"C1","game_id":"2024_03_LAC_PIT","side":"home","clv_bps":386.484412742618,"units":0.8},{"bt_run_id":"nfl_games_v1:7244a0bc8ac6","candidate":"C1","game_id":"2024_03_MIA_SEA","side":"away","clv_bps":578.847317031019,"units":-1},{"bt_run_id":"nfl_games_v1:7244a0bc8ac6","candidate":"C1","game_id":"2024_03_NE_NYJ","side":"away","clv_bps":86.8649644643327,"units":-1},{"bt_run_id":"nfl_games_v1:7244a0bc8ac6","candidate":"C1","game_id":"2024_03_NYG_CLE","side":"away","clv_bps":407.095391088381,"units":2.7},{"bt_run_id":"nfl_games_v1:7244a0bc8ac6","candidate":"C1","game_id":"2024_03_PHI_NO","side":"home","clv_bps":1138.5951250919,"units":-1},{"bt_run_id":"nfl_games_v1:7244a0bc8ac6","candidate":"C1","game_id":"2024_03_SF_LA","side":"home","clv_bps":470.289366816601,"units":2.8},{"bt_run_id":"nfl_games_v1:7244a0bc8ac6","candidate":"C1","game_id":"2024_03_WAS_CIN","side":"away","clv_bps":-106.422018348622,"units":3},{"bt_run_id":"nfl_games_v1:7244a0bc8ac6","candidate":"C1","game_id":"2024_04_BUF_BAL","side":"away","clv_bps":-272.379299173262,"units":-1},{"bt_run_id":"nfl_games_v1:7244a0bc8ac6","candidate":"C1","game_id":"2024_04_CIN_CAR","side":"home","clv_bps":324.003392705683,"units":-1},{"bt_run_id":"nfl_games_v1:7244a0bc8ac6","candidate":"C1","game_id":"2024_04_CLE_LV","side":"home","clv_bps":-773.773100389236,"units":0.952380952380952},{"bt_run_id":"nfl_games_v1:7244a0bc8ac6","candidate":"C1","game_id":"2024_04_DAL_NYG","side":"home","clv_bps":-326.428929686173,"units":-1},{"bt_run_id":"nfl_games_v1:7244a0bc8ac6","candidate":"C1","game_id":"2024_04_DEN_NYJ","side":"away","clv_bps":174.233177146905,"units":3.2},{"bt_run_id":"nfl_games_v1:7244a0bc8ac6","candidate":"C1","game_id":"2024_04_KC_LAC","side":"home","clv_bps":167.336826286503,"units":-1},{"bt_run_id":"nfl_games_v1:7244a0bc8ac6","candidate":"C1","game_id":"2024_04_NE_SF","side":"away","clv_bps":0,"units":-1},{"bt_run_id":"nfl_games_v1:7244a0bc8ac6","candidate":"C1","game_id":"2024_04_NO_ATL","side":"away","clv_bps":-295.762631529055,"units":-1},{"bt_run_id":"nfl_games_v1:7244a0bc8ac6","candidate":"C1","game_id":"2024_04_PHI_TB","side":"home","clv_bps":210.04408332613,"units":1.1},{"bt_run_id":"nfl_games_v1:7244a0bc8ac6","candidate":"C1","game_id":"2024_04_PIT_IND","side":"away","clv_bps":493.768433070118,"units":-1},{"bt_run_id":"nfl_games_v1:7244a0bc8ac6","candidate":"C1","game_id":"2024_04_SEA_DET","side":"away","clv_bps":-57.843242662079,"units":-1},{"bt_run_id":"nfl_games_v1:7244a0bc8ac6","candidate":"C1","game_id":"2024_04_TEN_MIA","side":"home","clv_bps":990.457824116214,"units":-1},{"bt_run_id":"nfl_games_v1:7244a0bc8ac6","candidate":"C1","game_id":"2024_04_WAS_ARI","side":"away","clv_bps":660.807029542408,"units":1.95},{"bt_run_id":"nfl_games_v1:7244a0bc8ac6","candidate":"C1","game_id":"2024_05_BAL_CIN","side":"away","clv_bps":-177.881371526713,"units":0.666666666666667},{"bt_run_id":"nfl_games_v1:7244a0bc8ac6","candidate":"C1","game_id":"2024_05_BUF_HOU","side":"away","clv_bps":-390.662698659275,"units":-1},{"bt_run_id":"nfl_games_v1:7244a0bc8ac6","candidate":"C1","game_id":"2024_05_CLE_WAS","side":"away","clv_bps":483.760731156576,"units":-1},{"bt_run_id":"nfl_games_v1:7244a0bc8ac6","candidate":"C1","game_id":"2024_05_DAL_PIT","side":"home","clv_bps":295.762631529055,"units":-1},{"bt_run_id":"nfl_games_v1:7244a0bc8ac6","candidate":"C1","game_id":"2024_05_GB_LA","side":"home","clv_bps":522.735208072641,"units":-1},{"bt_run_id":"nfl_games_v1:7244a0bc8ac6","candidate":"C1","game_id":"2024_05_IND_JAX","side":"away","clv_bps":-437.648584395938,"units":-1},{"bt_run_id":"nfl_games_v1:7244a0bc8ac6","candidate":"C1","game_id":"2024_05_LV_DEN","side":"home","clv_bps":370.883940057135,"units":0.769230769230769},{"bt_run_id":"nfl_games_v1:7244a0bc8ac6","candidate":"C1","game_id":"2024_05_NYJ_MIN","side":"home","clv_bps":193.002568530424,"units":0.769230769230769},{"bt_run_id":"nfl_games_v1:7244a0bc8ac6","candidate":"C1","game_id":"2024_05_TB_ATL","side":"away","clv_bps":0,"units":-1},{"bt_run_id":"nfl_games_v1:7244a0bc8ac6","candidate":"C1","game_id":"2024_06_ARI_GB","side":"home","clv_bps":358.075986020664,"units":0.434782608695652},{"bt_run_id":"nfl_games_v1:7244a0bc8ac6","candidate":"C1","game_id":"2024_06_ATL_CAR","side":"home","clv_bps":-326.428929686173,"units":-1},{"bt_run_id":"nfl_games_v1:7244a0bc8ac6","candidate":"C1","game_id":"2024_06_BUF_NYJ","side":"away","clv_bps":-403.046651856553,"units":0.714285714285714},{"bt_run_id":"nfl_games_v1:7244a0bc8ac6","candidate":"C1","game_id":"2024_06_CIN_NYG","side":"home","clv_bps":-194.676483080844,"units":-1},{"bt_run_id":"nfl_games_v1:7244a0bc8ac6","candidate":"C1","game_id":"2024_06_CLE_PHI","side":"away","clv_bps":92.8301646241381,"units":-1},{"bt_run_id":"nfl_games_v1:7244a0bc8ac6","candidate":"C1","game_id":"2024_06_DET_DAL","side":"home","clv_bps":-418.90494591054,"units":-1},{"bt_run_id":"nfl_games_v1:7244a0bc8ac6","candidate":"C1","game_id":"2024_06_HOU_NE","side":"home","clv_bps":643.299952312827,"units":-1},{"bt_run_id":"nfl_games_v1:7244a0bc8ac6","candidate":"C1","game_id":"2024_06_JAX_CHI","side":"home","clv_bps":-649.35064935065,"units":0.8},{"bt_run_id":"nfl_games_v1:7244a0bc8ac6","candidate":"C1","game_id":"2024_06_LAC_DEN","side":"home","clv_bps":-272.379299173263,"units":-1},{"bt_run_id":"nfl_games_v1:7244a0bc8ac6","candidate":"C1","game_id":"2024_06_PIT_LV","side":"away","clv_bps":446.568598784696,"units":0.714285714285714},{"bt_run_id":"nfl_games_v1:7244a0bc8ac6","candidate":"C1","game_id":"2024_07_BAL_TB","side":"home","clv_bps":-24